{
  "$schema": "https://json-schema.org/draft/2020-12/schema",
  "$id": "https://mendmark.dev/schemas/suite-v1.schema.json",
  "title": "Mendmark JSON suite",
  "type": "object",
  "additionalProperties": false,
  "required": ["schema_version", "cases", "tools"],
  "properties": {
    "schema_version": {"const": "1.0"},
    "policy": {
      "type": "object",
      "additionalProperties": false,
      "properties": {
        "minimum_kill_rate": {"type": "number", "minimum": 0, "maximum": 1},
        "fail_on_critical_survivor": {"type": "boolean"},
        "fail_on_untested_tools": {"type": "boolean"},
        "fail_on_tool_contract_issues": {"type": "boolean"},
        "fail_on_regression": {"type": "boolean"}
      }
    },
    "tools": {
      "type": "array",
      "items": {"$ref": "#/$defs/tool"}
    },
    "cases": {
      "type": "array",
      "minItems": 1,
      "items": {"$ref": "#/$defs/case"}
    }
  },
  "$defs": {
    "call": {
      "type": "object",
      "additionalProperties": false,
      "required": ["name"],
      "properties": {
        "name": {"type": "string", "minLength": 1},
        "input_parameters": {"type": "object"},
        "output": {},
        "description": {"type": ["string", "null"], "minLength": 1}
      }
    },
    "tool": {
      "type": "object",
      "additionalProperties": false,
      "required": ["name"],
      "properties": {
        "name": {"type": "string", "minLength": 1},
        "input_schema": {"type": "object"},
        "description": {"type": ["string", "null"], "minLength": 1},
        "side_effecting": {"type": "boolean"}
      }
    },
    "case": {
      "type": "object",
      "additionalProperties": false,
      "required": ["case_id", "input", "actual_output"],
      "properties": {
        "case_id": {"type": "string", "minLength": 1},
        "input": {"type": "string"},
        "actual_output": {"type": "string"},
        "expected_output": {"type": ["string", "null"]},
        "tools_called": {"type": "array", "items": {"$ref": "#/$defs/call"}},
        "expected_tools": {"type": "array", "items": {"$ref": "#/$defs/call"}},
        "metadata": {"type": "object"},
        "tags": {"type": "array", "items": {"type": "string", "minLength": 1}}
      }
    }
  }
}
